{
  "$schema": "./skin.schema.json",
  "format": 1,
  "id": "speedrun",
  "name": "Speedrun",
  "author": "Game Library Manager",
  "fonts": {
    "display": "Rajdhani",
    "mono": "JetBrains Mono"
  },
  "shared": {
    "radius-s": "2px",
    "radius-m": "3px",
    "radius-l": "4px"
  },
  "light": {
    "background": "#eef1f5",
    "surface": "#ffffff",
    "surface-raised": "#ffffff",
    "surface-sunken": "#dee1e5",
    "placeholder": "#d8dade",
    "border": "#d3d4d4",
    "border-strong": "#999a9b",
    "text": "#0d0f12",
    "text-muted": "#4f5966",
    "surface-accent": "#f1ece0",
    "surface-selected": "#e5dcc7",
    "accent": "#8a6200",
    "accent-hover": "#6e4e00",
    "on-accent": "#ffffff",
    "command-accent": "#8a6200",
    "command-accent-hover": "#6e4e00",
    "archive-accent": "#00799e",
    "archive-accent-strong": "#00556f",
    "archive-surface": "#d9ebf0",
    "focus": "#8a6200",
    "surface-backlog": "#ede7d9",
    "surface-error": "#f7e1e1",
    "error": "#c22727",
    "scrim": "rgba(13, 15, 18, 0.58)",
    "icon-frame": "#0d0f12",
    "icon-card-a": "#00799e",
    "icon-card-b": "#8a6200",
    "icon-card-c": "#8a6200",
    "art-pattern-a": "#9bc7d7",
    "art-pattern-b": "#cbbf9f",
    "art-pattern-c": "#a2c9b5",
    "art-pattern-d": "#e0abad",
    "status-backlog": "#8a6200",
    "status-playing": "#007498",
    "status-finished": "#157b3c",
    "status-abandoned": "#c62828",
    "price-low": "#157b3c",
    "shadow-soft": "0 6px 18px rgba(13, 15, 18, 0.08)",
    "shadow-raised": "0 14px 36px rgba(13, 15, 18, 0.12)"
  },
  "dark": {
    "background": "#0d0f12",
    "surface": "#13161b",
    "surface-raised": "#202328",
    "surface-sunken": "#090a0d",
    "placeholder": "#232528",
    "border": "#262c35",
    "border-strong": "#6c6f74",
    "text": "#e7eaf0",
    "text-muted": "#8f99a6",
    "surface-accent": "#2f2b18",
    "surface-selected": "#473c15",
    "accent": "#ffc400",
    "accent-hover": "#ffd033",
    "on-accent": "#000000",
    "command-accent": "#ffc400",
    "command-accent-hover": "#ffd033",
    "archive-accent": "#7fd3ff",
    "archive-accent-strong": "#a5e0ff",
    "archive-surface": "#23323d",
    "focus": "#ffc400",
    "surface-backlog": "#363017",
    "surface-error": "#341e22",
    "error": "#ff4d4d",
    "scrim": "rgba(0, 0, 0, 0.68)",
    "icon-frame": "#e7eaf0",
    "icon-card-a": "#7fd3ff",
    "icon-card-b": "#ffc400",
    "icon-card-c": "#ffc400",
    "art-pattern-a": "#355465",
    "art-pattern-b": "#624e0c",
    "art-pattern-c": "#175331",
    "art-pattern-d": "#622527",
    "status-backlog": "#ffc400",
    "status-playing": "#7fd3ff",
    "status-finished": "#29d16a",
    "status-abandoned": "#ff4d4d",
    "price-low": "#29d16a",
    "shadow-soft": "0 6px 18px rgba(0, 0, 0, 0.18)",
    "shadow-raised": "0 14px 36px rgba(0, 0, 0, 0.28)"
  }
}
