{
  "$schema": "./skin.schema.json",
  "format": 1,
  "id": "point-and-click",
  "name": "Point & Click",
  "author": "Game Library Manager",
  "fonts": {
    "display": "Pixelify Sans"
  },
  "shared": {
    "radius-s": "2px",
    "radius-m": "4px",
    "radius-l": "6px"
  },
  "light": {
    "background": "#e9d7ae",
    "surface": "#f4e9c8",
    "surface-raised": "#faf4e4",
    "surface-sunken": "#ddcaa3",
    "placeholder": "#d8c59e",
    "border": "#d3c6a7",
    "border-strong": "#a6967c",
    "text": "#3b2412",
    "text-muted": "#6a4a2a",
    "surface-accent": "#e5d1bb",
    "surface-selected": "#d9bdb0",
    "accent": "#7a1f5c",
    "accent-hover": "#62194a",
    "on-accent": "#ffffff",
    "command-accent": "#7a1f5c",
    "command-accent-hover": "#62194a",
    "archive-accent": "#7a4a24",
    "archive-accent-strong": "#553419",
    "archive-surface": "#e2d1af",
    "focus": "#7a1f5c",
    "surface-backlog": "#dfd1aa",
    "surface-error": "#e7cdb0",
    "error": "#9a1f1f",
    "scrim": "rgba(59, 36, 18, 0.58)",
    "icon-frame": "#3b2412",
    "icon-card-a": "#7a4a24",
    "icon-card-b": "#7a1f5c",
    "icon-card-c": "#6a4a00",
    "art-pattern-a": "#c2a67e",
    "art-pattern-b": "#c29791",
    "art-pattern-c": "#a6b180",
    "art-pattern-d": "#c29791",
    "status-backlog": "#6a4a00",
    "status-playing": "#1f5a7a",
    "status-finished": "#2a6a2a",
    "status-abandoned": "#7a1f5c",
    "price-low": "#2a6a2a",
    "shadow-soft": "0 6px 18px rgba(59, 36, 18, 0.08)",
    "shadow-raised": "0 14px 36px rgba(59, 36, 18, 0.12)"
  },
  "dark": {
    "background": "#07051a",
    "surface": "#120c3a",
    "surface-raised": "#201943",
    "surface-sunken": "#050412",
    "placeholder": "#1f1c2b",
    "border": "#2b1f80",
    "border-strong": "#716976",
    "text": "#f4e9c8",
    "text-muted": "#c9bfe0",
    "surface-accent": "#142047",
    "surface-selected": "#153152",
    "accent": "#1fb5a8",
    "accent-hover": "#4cc4b9",
    "on-accent": "#000000",
    "command-accent": "#1fb5a8",
    "command-accent-hover": "#4cc4b9",
    "archive-accent": "#ff9a2e",
    "archive-accent-strong": "#ffb86d",
    "archive-surface": "#362138",
    "focus": "#ffe27a",
    "surface-backlog": "#362c44",
    "surface-error": "#331e43",
    "error": "#ff8a7a",
    "scrim": "rgba(0, 0, 0, 0.68)",
    "icon-frame": "#f4e9c8",
    "icon-card-a": "#ff9a2e",
    "icon-card-b": "#1fb5a8",
    "icon-card-c": "#ffe27a",
    "art-pattern-a": "#5e3921",
    "art-pattern-b": "#0f434c",
    "art-pattern-c": "#3b5447",
    "art-pattern-d": "#5e2e5d",
    "status-backlog": "#ffe27a",
    "status-playing": "#7ef3e6",
    "status-finished": "#9be89b",
    "status-abandoned": "#ff7ad9",
    "price-low": "#9be89b",
    "shadow-soft": "0 6px 18px rgba(0, 0, 0, 0.18)",
    "shadow-raised": "0 14px 36px rgba(0, 0, 0, 0.28)"
  }
}
