{
  "$schema": "./skin.schema.json",
  "format": 1,
  "id": "arcade",
  "name": "Arcade",
  "author": "Game Library Manager",
  "fonts": {
    "display": "Press Start 2P"
  },
  "shared": {
    "radius-s": "0px",
    "radius-m": "0px",
    "radius-l": "0px"
  },
  "light": {
    "background": "#f4f4ee",
    "surface": "#ffffff",
    "surface-raised": "#ffffff",
    "surface-sunken": "#e4e4df",
    "placeholder": "#ddddd8",
    "border": "#d4d4d4",
    "border-strong": "#9b9b9b",
    "text": "#111111",
    "text-muted": "#4a4f55",
    "surface-accent": "#f8e0eb",
    "surface-selected": "#f2c7db",
    "accent": "#c2005b",
    "accent-hover": "#9b0049",
    "on-accent": "#ffffff",
    "command-accent": "#c2005b",
    "command-accent-hover": "#9b0049",
    "archive-accent": "#007c8a",
    "archive-accent-strong": "#005761",
    "archive-surface": "#d9ebed",
    "focus": "#c2005b",
    "surface-backlog": "#ede9d9",
    "surface-error": "#f4dbe0",
    "error": "#b00020",
    "scrim": "rgba(17, 17, 17, 0.58)",
    "icon-frame": "#111111",
    "icon-card-a": "#007c8a",
    "icon-card-b": "#c2005b",
    "icon-card-c": "#8a6d00",
    "art-pattern-a": "#9fcacb",
    "art-pattern-b": "#e29fbb",
    "art-pattern-c": "#a9c99f",
    "art-pattern-d": "#dc9fb1",
    "status-backlog": "#876b00",
    "status-playing": "#00708a",
    "status-finished": "#1d7a0c",
    "status-abandoned": "#b0003f",
    "price-low": "#1d7a0c",
    "shadow-soft": "0 6px 18px rgba(17, 17, 17, 0.08)",
    "shadow-raised": "0 14px 36px rgba(17, 17, 17, 0.12)"
  },
  "dark": {
    "background": "#000000",
    "surface": "#0d0d0d",
    "surface-raised": "#1a1a1a",
    "surface-sunken": "#000000",
    "placeholder": "#181818",
    "border": "#262626",
    "border-strong": "#6b6b6b",
    "text": "#ededed",
    "text-muted": "#b9c3ca",
    "surface-accent": "#2a111c",
    "surface-selected": "#421428",
    "accent": "#ff2e88",
    "accent-hover": "#ff58a0",
    "on-accent": "#000000",
    "command-accent": "#ff2e88",
    "command-accent-hover": "#ff58a0",
    "archive-accent": "#29f0ff",
    "archive-accent-strong": "#69f4ff",
    "archive-surface": "#112f31",
    "focus": "#ffe600",
    "surface-backlog": "#312e0b",
    "surface-error": "#2f1818",
    "error": "#ff5c5c",
    "scrim": "rgba(0, 0, 0, 0.68)",
    "icon-frame": "#ededed",
    "icon-card-a": "#29f0ff",
    "icon-card-b": "#ff2e88",
    "icon-card-c": "#ffe600",
    "art-pattern-a": "#0e5459",
    "art-pattern-b": "#591030",
    "art-pattern-c": "#145907",
    "art-pattern-d": "#591030",
    "status-backlog": "#ffe600",
    "status-playing": "#29f0ff",
    "status-finished": "#39ff14",
    "status-abandoned": "#ff2e88",
    "price-low": "#39ff14",
    "shadow-soft": "0 6px 18px rgba(0, 0, 0, 0.18)",
    "shadow-raised": "0 14px 36px rgba(0, 0, 0, 0.28)"
  }
}
