{
  "$schema": "./skin.schema.json",
  "format": 1,
  "id": "jrpg",
  "name": "JRPG",
  "author": "Game Library Manager",
  "fonts": {
    "display": "DotGothic16",
    "mono": "DotGothic16"
  },
  "shared": {
    "radius-s": "2px",
    "radius-m": "4px",
    "radius-l": "6px"
  },
  "light": {
    "background": "#e9ecff",
    "surface": "#ffffff",
    "surface-raised": "#ffffff",
    "surface-sunken": "#d9dcf0",
    "placeholder": "#d2d5ea",
    "border": "#d2d2d9",
    "border-strong": "#9697a6",
    "text": "#05072a",
    "text-muted": "#3a4180",
    "surface-accent": "#e4e5f1",
    "surface-selected": "#cdd0e5",
    "accent": "#1a2a8a",
    "accent-hover": "#15226e",
    "on-accent": "#ffffff",
    "command-accent": "#1a2a8a",
    "command-accent-hover": "#15226e",
    "archive-accent": "#8a5a00",
    "archive-accent-strong": "#613f00",
    "archive-surface": "#ede6d9",
    "focus": "#3142a8",
    "surface-backlog": "#ebe6d9",
    "surface-error": "#f4e1df",
    "error": "#b3261e",
    "scrim": "rgba(5, 7, 42, 0.58)",
    "icon-frame": "#05072a",
    "icon-card-a": "#8a5a00",
    "icon-card-b": "#1a2a8a",
    "icon-card-c": "#7a5b00",
    "art-pattern-a": "#c8b9a6",
    "art-pattern-b": "#a1a8d6",
    "art-pattern-c": "#a0c1bc",
    "art-pattern-d": "#d2abb5",
    "status-backlog": "#7a5b00",
    "status-playing": "#1a3fa8",
    "status-finished": "#17723f",
    "status-abandoned": "#a8322c",
    "price-low": "#17723f",
    "shadow-soft": "0 6px 18px rgba(5, 7, 42, 0.08)",
    "shadow-raised": "0 14px 36px rgba(5, 7, 42, 0.12)"
  },
  "dark": {
    "background": "#060820",
    "surface": "#0a1050",
    "surface-raised": "#191e5a",
    "surface-sunken": "#040616",
    "placeholder": "#1f2136",
    "border": "#3142a8",
    "border-strong": "#8d96d2",
    "text": "#ffffff",
    "text-muted": "#c8cffc",
    "surface-accent": "#272853",
    "surface-selected": "#403c55",
    "accent": "#ffd966",
    "accent-hover": "#ffe185",
    "on-accent": "#000000",
    "command-accent": "#ffd966",
    "command-accent-hover": "#ffe185",
    "archive-accent": "#ff8a8a",
    "archive-accent-strong": "#ffadad",
    "archive-surface": "#2f2259",
    "focus": "#ffd966",
    "surface-backlog": "#2f2e53",
    "surface-error": "#2c2158",
    "error": "#ff8a8a",
    "scrim": "rgba(0, 0, 0, 0.68)",
    "icon-frame": "#ffffff",
    "icon-card-a": "#ff8a8a",
    "icon-card-b": "#ffd966",
    "icon-card-c": "#ffd966",
    "art-pattern-a": "#5d3645",
    "art-pattern-b": "#5d5138",
    "art-pattern-c": "#2b554b",
    "art-pattern-d": "#5d3645",
    "status-backlog": "#ffd966",
    "status-playing": "#9fb4ff",
    "status-finished": "#6fe39a",
    "status-abandoned": "#ff8a8a",
    "price-low": "#6fe39a",
    "shadow-soft": "0 6px 18px rgba(0, 0, 0, 0.18)",
    "shadow-raised": "0 14px 36px rgba(0, 0, 0, 0.28)"
  }
}
