{
  "$schema": "./skin.schema.json",
  "format": 1,
  "id": "souls",
  "name": "Souls",
  "author": "Game Library Manager",
  "fonts": {
    "display": "Cinzel",
    "body": "EB Garamond"
  },
  "shared": {
    "radius-s": "0px",
    "radius-m": "2px",
    "radius-l": "2px"
  },
  "light": {
    "background": "#ece6d6",
    "surface": "#f5f0e3",
    "surface-raised": "#faf8f1",
    "surface-sunken": "#ddd7c8",
    "placeholder": "#d7d1c2",
    "border": "#cec9bd",
    "border-strong": "#99948b",
    "text": "#1a1612",
    "text-muted": "#5a5244",
    "surface-accent": "#e8dbc9",
    "surface-selected": "#ddc9b4",
    "accent": "#8a3f0c",
    "accent-hover": "#6e320a",
    "on-accent": "#ffffff",
    "command-accent": "#8a3f0c",
    "command-accent-hover": "#6e320a",
    "archive-accent": "#6e5a22",
    "archive-accent-strong": "#4d3f18",
    "archive-surface": "#e1dac6",
    "focus": "#8a3f0c",
    "surface-backlog": "#e1dac6",
    "surface-error": "#e7d4c7",
    "error": "#8f2a1a",
    "scrim": "rgba(26, 22, 18, 0.58)",
    "icon-frame": "#1a1612",
    "icon-card-a": "#6e5a22",
    "icon-card-b": "#8a3f0c",
    "icon-card-c": "#6e5a22",
    "art-pattern-a": "#c0b597",
    "art-pattern-b": "#caac8f",
    "art-pattern-c": "#afb59a",
    "art-pattern-d": "#cba494",
    "status-backlog": "#6e5a22",
    "status-playing": "#2e4a66",
    "status-finished": "#3d5a2a",
    "status-abandoned": "#8f2a1a",
    "price-low": "#3d5a2a",
    "shadow-soft": "0 6px 18px rgba(26, 22, 18, 0.08)",
    "shadow-raised": "0 14px 36px rgba(26, 22, 18, 0.12)"
  },
  "dark": {
    "background": "#0a0908",
    "surface": "#120f0c",
    "surface-raised": "#1e1b17",
    "surface-sunken": "#070606",
    "placeholder": "#1f1d1b",
    "border": "#3a3731",
    "border-strong": "#656159",
    "text": "#d8d2c4",
    "text-muted": "#9a937f",
    "surface-accent": "#2b1c10",
    "surface-selected": "#3f2713",
    "accent": "#e07b2c",
    "accent-hover": "#e69556",
    "on-accent": "#000000",
    "command-accent": "#e07b2c",
    "command-accent-hover": "#e69556",
    "archive-accent": "#b39b5a",
    "archive-accent-strong": "#cab98c",
    "archive-surface": "#2a2418",
    "focus": "#e07b2c",
    "surface-backlog": "#2a2418",
    "surface-error": "#2f1b15",
    "error": "#e0664c",
    "scrim": "rgba(0, 0, 0, 0.68)",
    "icon-frame": "#d8d2c4",
    "icon-card-a": "#b39b5a",
    "icon-card-b": "#e07b2c",
    "icon-card-c": "#b39b5a",
    "art-pattern-a": "#453c25",
    "art-pattern-b": "#553115",
    "art-pattern-c": "#394330",
    "art-pattern-d": "#4d2b25",
    "status-backlog": "#b39b5a",
    "status-playing": "#9fb3c8",
    "status-finished": "#8fb07a",
    "status-abandoned": "#c96a5a",
    "price-low": "#8fb07a",
    "shadow-soft": "0 6px 18px rgba(0, 0, 0, 0.18)",
    "shadow-raised": "0 14px 36px rgba(0, 0, 0, 0.28)"
  }
}
