{
  "$schema": "./skin.schema.json",
  "format": 1,
  "id": "magazine",
  "name": "Magazine",
  "author": "Game Library Manager",
  "fonts": {
    "display": "Anton",
    "body": "Archivo Narrow"
  },
  "shared": {
    "radius-s": "0px",
    "radius-m": "0px",
    "radius-l": "0px"
  },
  "light": {
    "background": "#f4efe2",
    "surface": "#fbf8ef",
    "surface-raised": "#fdfcf7",
    "surface-sunken": "#e4dfd3",
    "placeholder": "#ddd9cd",
    "border": "#111111",
    "border-strong": "#111111",
    "text": "#111111",
    "text-muted": "#4a463d",
    "surface-accent": "#f7dbd2",
    "surface-selected": "#f3c3ba",
    "accent": "#d80600",
    "accent-hover": "#ad0500",
    "on-accent": "#ffffff",
    "command-accent": "#d80600",
    "command-accent-hover": "#ad0500",
    "archive-accent": "#0047bb",
    "archive-accent-strong": "#003283",
    "archive-surface": "#d5dde7",
    "focus": "#0047bb",
    "surface-backlog": "#eae3cb",
    "surface-error": "#f0d5ce",
    "error": "#b00000",
    "scrim": "rgba(17, 17, 17, 0.58)",
    "icon-frame": "#111111",
    "icon-card-a": "#0047bb",
    "icon-card-b": "#d80600",
    "icon-card-c": "#8a6a00",
    "art-pattern-a": "#9fb4d4",
    "art-pattern-b": "#ea9d93",
    "art-pattern-c": "#a2c1a3",
    "art-pattern-d": "#e29d93",
    "status-backlog": "#846600",
    "status-playing": "#0047bb",
    "status-finished": "#0b6b2e",
    "status-abandoned": "#c00500",
    "price-low": "#0b6b2e",
    "shadow-soft": "3px 3px 0 #111111",
    "shadow-raised": "6px 6px 0 #111111"
  },
  "dark": {
    "background": "#111111",
    "surface": "#1b1b1b",
    "surface-raised": "#282827",
    "surface-sunken": "#0c0c0c",
    "placeholder": "#282726",
    "border": "#42413f",
    "border-strong": "#76746f",
    "text": "#f4efe2",
    "text-muted": "#bdb6a6",
    "surface-accent": "#363118",
    "surface-selected": "#4d4415",
    "accent": "#ffd400",
    "accent-hover": "#ffdd33",
    "on-accent": "#000000",
    "command-accent": "#ffd400",
    "command-accent-hover": "#ffdd33",
    "archive-accent": "#ff4b3e",
    "archive-accent-strong": "#ff8178",
    "archive-surface": "#3d2220",
    "focus": "#ffd400",
    "surface-backlog": "#3d3717",
    "surface-error": "#3b2624",
    "error": "#ff6b5e",
    "scrim": "rgba(0, 0, 0, 0.68)",
    "icon-frame": "#f4efe2",
    "icon-card-a": "#ff4b3e",
    "icon-card-b": "#ffd400",
    "icon-card-c": "#ffd400",
    "art-pattern-a": "#642521",
    "art-pattern-b": "#64550b",
    "art-pattern-c": "#30553b",
    "art-pattern-d": "#64302c",
    "status-backlog": "#ffd400",
    "status-playing": "#7fa8ff",
    "status-finished": "#6ad48a",
    "status-abandoned": "#ff6b5e",
    "price-low": "#6ad48a",
    "shadow-soft": "3px 3px 0 #000000",
    "shadow-raised": "6px 6px 0 #000000"
  }
}
