{
  "$schema": "./skin.schema.json",
  "format": 1,
  "id": "handheld",
  "name": "Handheld",
  "author": "Game Library Manager",
  "fonts": {
    "display": "Silkscreen"
  },
  "shared": {
    "radius-s": "0px",
    "radius-m": "0px",
    "radius-l": "0px"
  },
  "light": {
    "background": "#9bbc0f",
    "surface": "#a9c62a",
    "surface-raised": "#b5d040",
    "surface-sunken": "#8bac0f",
    "placeholder": "#8daf0f",
    "border": "#8dac25",
    "border-strong": "#688a1f",
    "text": "#0f380f",
    "text-muted": "#244a24",
    "surface-accent": "#97b527",
    "surface-selected": "#87a724",
    "accent": "#0f380f",
    "accent-hover": "#0c2d0c",
    "on-accent": "#ffffff",
    "command-accent": "#0f380f",
    "command-accent-hover": "#0c2d0c",
    "archive-accent": "#306230",
    "archive-accent-strong": "#224522",
    "archive-surface": "#97b72b",
    "focus": "#0f380f",
    "surface-backlog": "#9bb124",
    "surface-error": "#a0ad2b",
    "error": "#6b1030",
    "scrim": "rgba(15, 56, 15, 0.58)",
    "icon-frame": "#0f380f",
    "icon-card-a": "#306230",
    "icon-card-b": "#0f380f",
    "icon-card-c": "#4a3a00",
    "art-pattern-a": "#769c1b",
    "art-pattern-b": "#6a8e0f",
    "art-pattern-c": "#6a8e0f",
    "art-pattern-d": "#8a801b",
    "status-backlog": "#4a3a00",
    "status-playing": "#123a5c",
    "status-finished": "#0f380f",
    "status-abandoned": "#6b1030",
    "price-low": "#0f380f",
    "shadow-soft": "0 6px 18px rgba(15, 56, 15, 0.08)",
    "shadow-raised": "0 14px 36px rgba(15, 56, 15, 0.12)"
  },
  "dark": {
    "background": "#0f380f",
    "surface": "#184418",
    "surface-raised": "#224d1b",
    "surface-sunken": "#0a270a",
    "placeholder": "#214915",
    "border": "#376021",
    "border-strong": "#60862d",
    "text": "#c4e04a",
    "text-muted": "#9ebf14",
    "surface-accent": "#285217",
    "surface-selected": "#355e16",
    "accent": "#9bbc0f",
    "accent-hover": "#afc93f",
    "on-accent": "#000000",
    "command-accent": "#9bbc0f",
    "command-accent-hover": "#afc93f",
    "archive-accent": "#8bac0f",
    "archive-accent-strong": "#aec557",
    "archive-surface": "#295417",
    "focus": "#c4e04a",
    "surface-backlog": "#375924",
    "surface-error": "#38542e",
    "error": "#ffb3b3",
    "scrim": "rgba(0, 0, 0, 0.68)",
    "icon-frame": "#c4e04a",
    "icon-card-a": "#8bac0f",
    "icon-card-b": "#9bbc0f",
    "icon-card-c": "#e8d36b",
    "art-pattern-a": "#3a610f",
    "art-pattern-b": "#40660f",
    "art-pattern-c": "#40660f",
    "art-pattern-d": "#636348",
    "status-backlog": "#e8d36b",
    "status-playing": "#b8e0ff",
    "status-finished": "#9bbc0f",
    "status-abandoned": "#ffb3b3",
    "price-low": "#c4e04a",
    "shadow-soft": "0 6px 18px rgba(0, 0, 0, 0.18)",
    "shadow-raised": "0 14px 36px rgba(0, 0, 0, 0.28)"
  }
}
