{
  "$schema": "./skin.schema.json",
  "format": 1,
  "id": "demoscene",
  "name": "Demoscene",
  "author": "Game Library Manager",
  "fonts": {
    "display": "VT323",
    "mono": "IBM Plex Mono"
  },
  "shared": {
    "radius-s": "0px",
    "radius-m": "0px",
    "radius-l": "0px"
  },
  "light": {
    "background": "#aaaaaa",
    "surface": "#c4c4c4",
    "surface-raised": "#d4d4d4",
    "surface-sunken": "#999999",
    "placeholder": "#999999",
    "border": "#a1a1a1",
    "border-strong": "#727272",
    "text": "#000000",
    "text-muted": "#262626",
    "surface-accent": "#acb4bb",
    "surface-selected": "#99a6b4",
    "accent": "#003d7a",
    "accent-hover": "#003162",
    "on-accent": "#ffffff",
    "command-accent": "#003d7a",
    "command-accent-hover": "#003162",
    "archive-accent": "#8a3a00",
    "archive-accent-strong": "#612900",
    "archive-surface": "#bbafa7",
    "focus": "#0053a7",
    "surface-backlog": "#b2afa7",
    "surface-error": "#baa9a9",
    "error": "#7a0000",
    "scrim": "rgba(0, 0, 0, 0.58)",
    "icon-frame": "#000000",
    "icon-card-a": "#8a3a00",
    "icon-card-b": "#003d7a",
    "icon-card-c": "#4a3a00",
    "art-pattern-a": "#9f836e",
    "art-pattern-b": "#6e8499",
    "art-pattern-c": "#728872",
    "art-pattern-d": "#946e94",
    "status-backlog": "#4a3a00",
    "status-playing": "#003c7b",
    "status-finished": "#0a470a",
    "status-abandoned": "#6a006a",
    "price-low": "#0a470a",
    "shadow-soft": "0 6px 18px rgba(0, 0, 0, 0.08)",
    "shadow-raised": "0 14px 36px rgba(0, 0, 0, 0.12)"
  },
  "dark": {
    "background": "#000000",
    "surface": "#0b0b14",
    "surface-raised": "#1a1a22",
    "surface-sunken": "#000000",
    "placeholder": "#1a1a1a",
    "border": "#37373e",
    "border-strong": "#717177",
    "text": "#ffffff",
    "text-muted": "#aab4c8",
    "surface-accent": "#281a12",
    "surface-selected": "#412610",
    "accent": "#ff8800",
    "accent-hover": "#ffa033",
    "on-accent": "#000000",
    "command-accent": "#ff8800",
    "command-accent-hover": "#ffa033",
    "archive-accent": "#55ffff",
    "archive-accent-strong": "#88ffff",
    "archive-surface": "#163037",
    "focus": "#ffff55",
    "surface-backlog": "#30301e",
    "surface-error": "#2d151d",
    "error": "#ff5555",
    "scrim": "rgba(0, 0, 0, 0.68)",
    "icon-frame": "#ffffff",
    "icon-card-a": "#55ffff",
    "icon-card-b": "#ff8800",
    "icon-card-c": "#ffff55",
    "art-pattern-a": "#1e5959",
    "art-pattern-b": "#593000",
    "art-pattern-c": "#1e591e",
    "art-pattern-d": "#591e59",
    "status-backlog": "#ffff55",
    "status-playing": "#55ffff",
    "status-finished": "#55ff55",
    "status-abandoned": "#ff55ff",
    "price-low": "#55ff55",
    "shadow-soft": "0 6px 18px rgba(0, 0, 0, 0.18)",
    "shadow-raised": "0 14px 36px rgba(0, 0, 0, 0.28)"
  }
}
