{
  "$schema": "./skin.schema.json",
  "format": 1,
  "id": "cards",
  "name": "Cards",
  "author": "Game Library Manager",
  "fonts": {
    "display": "Cinzel"
  },
  "shared": {
    "radius-s": "4px",
    "radius-m": "8px",
    "radius-l": "12px"
  },
  "light": {
    "background": "#f6f0df",
    "surface": "#fbf7ea",
    "surface-raised": "#fdfbf4",
    "surface-sunken": "#e7e2d3",
    "placeholder": "#e0dcce",
    "border": "#d3d1c9",
    "border-strong": "#9e9f9d",
    "text": "#1e2633",
    "text-muted": "#4d5566",
    "surface-accent": "#e2e1df",
    "surface-selected": "#cdcfd5",
    "accent": "#2b3f8c",
    "accent-hover": "#223270",
    "on-accent": "#ffffff",
    "command-accent": "#2b3f8c",
    "command-accent-hover": "#223270",
    "archive-accent": "#a8541f",
    "archive-accent-strong": "#763b16",
    "archive-surface": "#efdfcc",
    "focus": "#2b3f8c",
    "surface-backlog": "#e8dfc7",
    "surface-error": "#efdacd",
    "error": "#a3261e",
    "scrim": "rgba(30, 38, 51, 0.58)",
    "icon-frame": "#1e2633",
    "icon-card-a": "#a8541f",
    "icon-card-b": "#2b3f8c",
    "icon-card-c": "#7a5a00",
    "art-pattern-a": "#dbb99c",
    "art-pattern-b": "#afb2c2",
    "art-pattern-c": "#aac1a9",
    "art-pattern-d": "#d9a99b",
    "status-backlog": "#7a5a00",
    "status-playing": "#2b3f8c",
    "status-finished": "#1e6b45",
    "status-abandoned": "#a3261e",
    "price-low": "#1e6b45",
    "shadow-soft": "0 6px 18px rgba(30, 38, 51, 0.08)",
    "shadow-raised": "0 14px 36px rgba(30, 38, 51, 0.12)"
  },
  "dark": {
    "background": "#0b2619",
    "surface": "#123a2a",
    "surface-raised": "#204534",
    "surface-sunken": "#081b12",
    "placeholder": "#223a2c",
    "border": "#3a5a48",
    "border-strong": "#708471",
    "text": "#f3ead3",
    "text-muted": "#c9c0a6",
    "surface-accent": "#2c4830",
    "surface-selected": "#415435",
    "accent": "#e8b25a",
    "accent-hover": "#edc17b",
    "on-accent": "#000000",
    "command-accent": "#e8b25a",
    "command-accent-hover": "#edc17b",
    "archive-accent": "#e0703a",
    "archive-accent-strong": "#e99b75",
    "archive-surface": "#31422c",
    "focus": "#e8b25a",
    "surface-backlog": "#324c31",
    "surface-error": "#334737",
    "error": "#ff9a8a",
    "scrim": "rgba(0, 0, 0, 0.68)",
    "icon-frame": "#f3ead3",
    "icon-card-a": "#e0703a",
    "icon-card-b": "#e8b25a",
    "icon-card-c": "#e8b25a",
    "art-pattern-a": "#564025",
    "art-pattern-b": "#585730",
    "art-pattern-c": "#39674e",
    "art-pattern-d": "#604f41",
    "status-backlog": "#e8b25a",
    "status-playing": "#a8c0ff",
    "status-finished": "#8fe0b0",
    "status-abandoned": "#ff9a8a",
    "price-low": "#8fe0b0",
    "shadow-soft": "0 6px 18px rgba(0, 0, 0, 0.18)",
    "shadow-raised": "0 14px 36px rgba(0, 0, 0, 0.28)"
  }
}
