{
  "$schema": "./skin.schema.json",
  "format": 1,
  "id": "memory-card",
  "name": "Memory Card",
  "author": "Game Library Manager",
  "fonts": {
    "body": "Saira",
    "display": "Saira"
  },
  "shared": {
    "radius-s": "4px",
    "radius-m": "10px",
    "radius-l": "16px"
  },
  "light": {
    "background": "#eef3fa",
    "surface": "#ffffff",
    "surface-raised": "#ffffff",
    "surface-sunken": "#dee3eb",
    "placeholder": "#d7dde5",
    "border": "#d3d5d8",
    "border-strong": "#989ca4",
    "text": "#0a1426",
    "text-muted": "#46566d",
    "surface-accent": "#e7ebfa",
    "surface-selected": "#d4dbf7",
    "accent": "#3a5bd9",
    "accent-hover": "#2e49ae",
    "on-accent": "#ffffff",
    "command-accent": "#3a5bd9",
    "command-accent-hover": "#2e49ae",
    "archive-accent": "#b3531f",
    "archive-accent-strong": "#7d3a16",
    "archive-surface": "#f4e5dd",
    "focus": "#3a5bd9",
    "surface-backlog": "#ede6d9",
    "surface-error": "#f4e1df",
    "error": "#b3261e",
    "scrim": "rgba(10, 20, 38, 0.58)",
    "icon-frame": "#0a1426",
    "icon-card-a": "#b3531f",
    "icon-card-b": "#3a5bd9",
    "icon-card-c": "#8a5a00",
    "art-pattern-a": "#d9bbad",
    "art-pattern-b": "#afbeee",
    "art-pattern-c": "#a3c6bc",
    "art-pattern-d": "#d6afb2",
    "status-backlog": "#8a5a00",
    "status-playing": "#2a4bb8",
    "status-finished": "#17724a",
    "status-abandoned": "#a8322c",
    "price-low": "#17724a",
    "shadow-soft": "0 6px 18px rgba(10, 20, 38, 0.08)",
    "shadow-raised": "0 14px 36px rgba(10, 20, 38, 0.12)"
  },
  "dark": {
    "background": "#02040a",
    "surface": "#0a1426",
    "surface-raised": "#172132",
    "surface-sunken": "#010307",
    "placeholder": "#181b21",
    "border": "#303a4b",
    "border-strong": "#636c7b",
    "text": "#dde6f1",
    "text-muted": "#aab8cb",
    "surface-accent": "#1c2940",
    "surface-selected": "#2a3b56",
    "accent": "#9cc4ff",
    "accent-hover": "#b0d0ff",
    "on-accent": "#000000",
    "command-accent": "#9cc4ff",
    "command-accent-hover": "#b0d0ff",
    "archive-accent": "#e0703a",
    "archive-accent-strong": "#e99b75",
    "archive-surface": "#2a2229",
    "focus": "#e2f0ff",
    "surface-backlog": "#2b2c2e",
    "surface-error": "#2c2532",
    "error": "#ff8a7a",
    "scrim": "rgba(0, 0, 0, 0.68)",
    "icon-frame": "#dde6f1",
    "icon-card-a": "#e0703a",
    "icon-card-b": "#9cc4ff",
    "icon-card-c": "#e8b25a",
    "art-pattern-a": "#502a1b",
    "art-pattern-b": "#384760",
    "art-pattern-c": "#2e4d41",
    "art-pattern-d": "#5b3331",
    "status-backlog": "#e8b25a",
    "status-playing": "#9cc4ff",
    "status-finished": "#7fd6a8",
    "status-abandoned": "#ff8a7a",
    "price-low": "#7fd6a8",
    "shadow-soft": "0 6px 18px rgba(0, 0, 0, 0.18)",
    "shadow-raised": "0 14px 36px rgba(0, 0, 0, 0.28)"
  }
}
